base_price,discounted_price,product_name,category,brand,description
"2,80",1.93,Boisson végétale à base de riz - 3x200 ml,Epicerie,Lima,"Il y a plus de 20 ans, Lima lançait la première boisson au riz en Europe, le Rêv'Riz. Aujourd'hui rebaptisé Rice Drink Original, il est toujours LA référence. Il se distingue d'une boisson nature par une très légère touche de vanille qui lui confère sa saveur unique. Le goût naturellement sucré de cette boisson fraîche a conquis toutes les générations à tout moment de la journée."
"3,60",2.35,Absorbant d'odeurs naturel lavande,Tout pour la maison,Argiletz,"Parfumée à la lavande, l’argile absorbe les odeurs de cigarettes et neutralise les odeurs du quotidien."
"3,43",2.70,Petits pots patates douces et légumes du soleil dès 8 mois - 2x200 g,Bébé et enfant,Babybio,"Les producteurs Babybio ont réuni leurs talents pour cette recette aux saveurs du Sud. Poivrons d'Espagne, tomates d'Italie, patates douces et carottes des Landes... Tous ces petits légumes viennent illuminer cette recette comme un vrai rayon de soleil dans la journée de bébé !"
"16,00",12.06,VRAC - penne semi-complètes,Epicerie,Aurore Market,Les pennes semi-complètes en vrac. Le bon gout des pates en vrac.
"1,61",1.28,Semoule fine de blé complet - 500g,Epicerie,Markal,"Idéal pour élaborer de nombreux plats traditionnels, simple et rapide d'utilisation."
"6,32",4.92,Quinoa real rouge - 500g,Epicerie,Artisans du monde,"Découvrez notre quinoa réal rouge équitable. Sans gluten et source de protéines végétales, il se caractérise par son gros grain moelleux au goût inimitable aux notes d’amande."
"8,87",6.59,Gel lavant mains lavande - 1L,Hygiène et beauté,Coslys,"La formule de ce Gel lavant mains lavande-citron Coslys nettoie tout en douceur vos mains sans les dessécher. Sans savon, ce gel lavant pour les mains contient de l'eau florale de reine des prés bio aux vertus apaisantes."
"4,00",2.60,Sauge feuilles - 40 g,Epicerie,L'herbier de France,Feuilles de SAUGE
"3,35",2.47,Confiture Orange Citron Mandarine - 320g,Epicerie,Mamie Bio,Idéal pour accompagner une tarte ou votre petits déjeuner.
"21,71",15.51,Floradix - Fer + Plantes - 500 ml,Santé,Salus,"Floradix est une boisson savoureuse, tonique, riche en fer et en vitamines B et C, tout ce qu'il faut pour contribuer à réduire la fatigue."
"10,67",7.91,Après-shampoing kératine - 250 ml,Hygiène et beauté,Coslys,L'Après shampoing cheveux fragilisés et indisciplinés Coslys prend soin des cheveux. L'association de céramide et de kératine végétale restructure la fibre capillaire et redonne éclat et brillance aux cheveux les plus fragiles.
"3,40",2.55,Mayonnaise vegan - 190g,Epicerie,Naturata,Pour une mayonnaise sans oeufs.
"3,60",2.64,Absorbant d'odeurs naturel agrumes,Tout pour la maison,Argiletz,"Parfumée aux agrumes, l’argile absorbe les odeurs de cigarettes et neutralise celles de la maison."
"1,81",1.39,Semoule blanche de blé dur fine - 500g,Epicerie,Markal,La semoule blanche est idéale pour vos recettes sucrées !
"9,90",6.84,Brumisateur brumessentielle,Santé,Aromandise,"Le brumisateur Brumessentielle de chez Aromandise, un brumisateur sans gaz. Gagnant du trophée OR Innovation Bio à la NatExpo 2018. Une innovation pour une utilisation en tant que parfum d’ambiance, cosmétique ou comme simple brumisateur en cas de forte chaleur."
"10,70",7.89,Déodorant en stick citron et menthe - 50 g,Hygiène et beauté,Savonnerie Buissonnière,"Véritable alternative naturelle sans alcool ni sels d'aluminium, ce déodorant est à la fois doux, efficace et très bien toléré par la peau."
"5,66",3.27,Anti calcaire vaporisateur - 500 ml,Tout pour la maison,Harmonie Verte,"Fait briller, action rapide et détartre sans frotter. Cet anti-calcaire ne contient pas de tensio-actif éthoxylé ni de lauryl éther sulfate."
"3,54",2.52,Flocons de petit épeautre - 500 g,Epicerie,Celnat,"Source de protéines, ces flocons de petit épeautre sont aussi riches en fibres."
"5,73",3.92,Denticlay Dentifrice anis digestif - 75 ml,Hygiène et beauté,Ciel d'Azur,"L'argile blanche est particulièrement recommandée en pâte dentifrice, extraits de Mélisse Bio, extrait d'Anis Bio, sel marin non raffiné."
"5,75",4.59,Café moulu décaféiné - 250g,Epicerie,Artisans du monde,La puissance du café version décaféiné !
"4,77",3.54,Riz rond blanc Italie - 1 kg,Epicerie,Celnat,"Rapide à cuire, ce riz blanc convient plus particulièrement pour les desserts."
"8,70",7.30,Rosé IGP Provence - Le Grand Saint Paul - 2018,"Vins, bières et alcool",Le Grand Saint Paul,IGP Provence  Millésime 2018
"8,00",4.53,Savon d'Alep 40% à froid - 150 g,Hygiène et beauté,Lauralep,Selon la recette ancestrale vieille de 4 000 ans.
"2,50",1.98,Sablés pur beurre aux amandes - 120 g,Epicerie,Bio Soleil,"Sablés pur beurre aux éclats d'amandes, bio et sans huile de palme. Par sachet de 2 sablés, ils sont faciles à transporter et adaptés aux petits creux en journée !"
"3,12",2.18,Chicza chewing-gum menthe poivrée - 30 g,Hygiène et beauté,Chicza,"Vous allez adorer ses saveurs naturelles fraiches et subtiles, ainsi que sa consistance idéale (ni trop dur, ni trop mou) qui sont des qualités propres à la gomme naturelle."
"5,30",4.20,Café moulu Congo corsé - 250g,Epicerie,Artisans du monde,"Le café Congo Artisans du Monde a un goût complexe, énergétique et intense à l’acidité fine. Il est implanté sur les hauts plateaux du lac de Kivu (1500 – 2000m) bénéficiant d’un sol volcanique exceptionnellement favorable à la culture d’un café arabica haut de gamme."
"1,90",1.38,Crème cuisine Shiitake - 20cl,Epicerie,Ecomil,"Profitez des bienfaits du shiitake, idéal pour préparer vos veloutés."
"2,60",1.83,Olives noires à la provençale - 130 g,Epicerie,Belle Nature,Ces olives ont été désamérisées uniquement à l'eau et au sel. Un délai de huit mois après récolte à été nécessaire pour leur préparation. La méthode artisanale utilisée date de plus de 25 siècles.
"5,18",2.90,"Soupe Thaï - 0,5 L",Epicerie,Karine & Jeff,"Un riche mélange de légumes parfumés (brocoli, courgettes et poivrons), mijoté avec du lait de coco, du jus de citron, de la coriandre et du gingembre. Une soupe douce aux saveurs subtiles."
"17,50",12.18,Coffret 10 lingettes de lavage avec filet de lavage,Hygiène et beauté,Lamazuna,"Une face blanche pour le fond de teint, une face rose pour le rouge à lèvres et mascara ! * S'utilisent simplement avec de l'eau * Réutilisables plus de 300 fois * Lavables en machine de 40° à 90° * Idéales pour les peaux sensibles"
"3,40",2.12,Tartines Ki'kroc sarrasin - 150g,Epicerie,Grillon d'Or,Ces tartines au sarrasin 
"3,41",2.59,Boisson végétale amande chia - 1L,Epicerie,Ecomil,Les bienfaits de la graine de chia dans une délicieuse boisson végétale !
"2,48",1.80,Petit pot pomme abricot céréales dès 4 mois - 2x130 g,Bébé et enfant,Babybio,"Retrouvez toute la douceur de la Méditerranée grâce aux abricots du Roussillon. Associés aux pommes d'Aquitaine, ils forment une purée de fruits douce et onctueuse. Et pour ajouter une touche de céréales, quelques grains de riz viennent parfaire ce dessert plein de tendresse."
"5,70",4.27,Pâte de curry jaune - doux - 100 g,Epicerie,Autour du riz,"La pâte de curry thaï jaune, vous servira à mettre de la couleur et de la saveur dans vos plats."
"3,08",2.16,Biscuits vanille pépite de chocolat - 130g,Epicerie,Dao,Cette toute nouvelle gamme de biscuits spécialement conçue pour les petits (et les grands !) contient au minimum 30 % de sucre en moins par rapport à la moyenne de biscuits enfants sur le marché et ils sont si savoureux que vous n’allez pas vous en apercevoir !
"3,31",2.49,Ravioli aux légumes - 360 g,Epicerie,Danival,Recette vegan. Fabriqué à partir de ravioli frais Ravioli avec 40% de farce et 60% de pâte pour un Ravioli parfumé en bouche.
"4,50",3.23,Un bol de riz à Ceylan - 350 g,Epicerie,Karine & Jeff,"Ce riz rond complet est cuisiné avec des petits légumes (courgettes, tomates, poivrons et oignons), le tout parfumé d'un mélange subtil d'épices soigneusement élaboré."
"3,50",2.39,Farine de riz blanc - 500 g,Epicerie,Nature et Compagnie,C’est la base idéale de la cuisine sans gluten.
"2,60",2.07,Concentré de tomates à 22% - 190 g,Epicerie,Emile Noël,"Ce concentré peut être rajouté à toute préparation à base de sauce tomate (pâtes, riz, plats cuisinés…)."
"3,91",2.84,Purée de poires - 360 g,Epicerie,Coteaux Nantais,"Délicatement granuleuse et somptueusement gouteuse, la purée 100% poires des Coteaux Nantais saura vous séduire par sa simplicité et son authenticité."
"2,20",1.62,Limonade citron vert - 330ml,Epicerie,Lemonaid,"Boisson rafraîchissante au citron vert, issue du commerce équitable"
"2,40",1.82,Biscuits apéritifs goût tomate basilic - 100 g,Epicerie,Dao,Ces petits biscuits apéritifs au bon goût de tomate/basilic sont au top pour l'apéro !
"12,90",6.45,Préservatifs - x10,Santé,Green Condoms,Préservatif Green Condoms
"5,00",3.42,Poivre noir grain - 50 g,Epicerie,Cook Arcadie,Pour assaisonner et relever vos plats. Fort.
"6,10",4.86,Café moulu Ethiopie - 250 g,Epicerie,Artisans du monde,"Le café Ethiopie Artisans du Monde est doux aux arômes fruités et finement boisés.Il est cultivé sur les hauts plateaux Ethiopiens dans la région d’Oromia,et est issu exclusivement de la variété premium Yirgacheffe, renommée dans le monde entier."
"2,50",1.58,VRAC - Flocons d'avoine gros,Epicerie,Celnat,"Ces flocons d’avoine complète sont précuits à la vapeur, ce qui les rend très pratiques et faciles à utiliser."
"2,36",1.60,Coton tige - x200,Hygiène et beauté,Silver Care,Sans plastique et avec un coton bio ces cotons tiges seront ravir les plus grands. Idéal pour vous nettoyer les oreilles avec douceur et de façon responsable.
"2,86",1.76,Graines à germer haricot mungo - 200 g,Epicerie,Germ'line,"D’une saveur discrète au léger goût de noix, les pousses de haricot Mungo apportent fraicheur et croquant à vos salades composées ou vos potages."
"5,99",4.65,Capsules mister Nelson décaféiné compatible Nespresso - x15,Epicerie,Terramoka,Arabica Bio décaféiné du Pérou en capsules 100% bio-dégradables - 0% d'aluminium.
"8,00",6.16,Sucre de fleur de coco - 500 g,Epicerie,Iswari,Le sucre de fleurs de coco est une alternative nutritive pour le sucre de table et les édulcorants artificiels. 
"1,99",1.38,Basilic feuille - 15 g,Epicerie,Cook Arcadie,Le basilic rafraîchit et embaume tous vos plats.
"7,08",5.12,Blanchissant - 1 kg,Tout pour la maison,Harmonie Verte,"Blanchissant sans chlore ni azurant option, il est efficace dès 40° C."
"2,61",1.85,Assiette aubergines macaroni dès 15 mois - 260 g,Bébé et enfant,Babybio,"D'où vient le secret de cette savoureuse assiette ? Des légumes comme les aubergines de Provence, les carottes des Landes et les pommes de terre du Val de Loire ? Ou bien les macaroni, la purée de tomates ou le parmesan ? Une chose est sûre, c'est que bébé savoure tout !"
"4,15",3.12,Cocktail vita 12 fruits - 75 cl,Epicerie,Vitamont,Les bénéfices de 12 jus en une seule bouteille.
"4,70",3.66,Céréales 3 fruits quinoa dès 6 mois - 220 g,Bébé et enfant,Babybio,Idéal pour bébé : équilibré et savoureux !
"3,20",2.38,Cookie pécan chocolat noir - 175g,Epicerie,Moulin du Pivert,"Le must des cookies, avec des méga pépites de chocolat noir et de noix de macadamia."
"4,06",2.91,Allume feu végétal - x12,Tout pour la maison,La droguerie écologique,"12 sachets allume-feu, écologiques et solidaires. Pour les barbecues à la belle saison et pour les feux de cheminées ou les poêles en hiver."
"4,20",3.11,Confiture extra Fraise Cerise Cassis - 320g,Epicerie,Mamie Bio,A cuisiner et à tartiner selon vos envies.
"4,25",3.37,Tartines aux noix - 200g,Epicerie,Emile Noël,Tartines Bio craquantes aux noix sans gluten
"3,73",2.74,Eau de coco - 50 cl,Epicerie,Vitamont,"Idéal pour se raffraichir ! Elle est traditionnellement utilisée, comme diurétique pour éliminer la cellulite aqueuse."
"17,00",12.00,Pailles Inox courte - x4 avec goupillon,Tout pour la maison,Onyx,Un moyen simple de lutter contre la pollution plastique.
"2,52",1.80,Petit pot pomme verveine dès 4 mois - 2x130 g,Bébé et enfant,Babybio,"Cultivées dans le respect de l'Agriculture Biologique, nos pommes d'Aquitaine ont toutes les caractéristiques pour séduire le palais des tout-petits : elles sont douces, sucrées et savoureuses! Mmmmh Bébé va se régaler !"
"16,00",12.06,VRAC - spirales blanches,Epicerie,Aurore Market,Les spirales blanches en vrac. Le bon gout des pates en vrac.
"4,02",2.68,Nettoyant vitres vaporisateur - 500 ml,Tout pour la maison,Harmonie Verte,"Ce Nettoyant dégraisse et fait briller vitres, surfaces : faïencées, vitrifiées, stratifiées, laquées etc... Il ne contient pas de tensio-actif éthoxylé ni de lauryl éther sulfate."
"3,88",2.90,Farine de millet - 500 g,Epicerie,Nature et Compagnie,"Riche en minéraux, cette farine au goût atypique s’associe avec d’autres farines pour réaliser de nombreuses recettes sucrées ou salées."
"10,00",7.89,Shampoing anti-pelliculaire cade sauge rhassoul - 500 ml,Hygiène et beauté,Cosmo Naturel,"Ce shampooing est particulièrement adapté pour lutter contre les problème de sécheuresse du cuir chevelu et de pellicules, d'une façon naturelle et non agressive."
"3,90",2.98,Dentifrice enfant fraise - 50ml,Bébé et enfant,Coslys,Dentifrice enfant goût fraise
"3,50",2.40,Chips pétales de carotte - 70 g,Epicerie,Croustisud,Ce sont de petites chips produites à partir de carottes fraîches finement découpées puis frites à basse température.
"7,00",4.90,Charbon actif kishu binchotan,Tout pour la maison,Aurore Market,"Fabriqué au Japon, ce charbon actif kishu binchotan permet de filtrer l'eau et d'améliorer sa qualité. Il est réalisé à partir de chêne Ubame, ce qui lui confère une excellente qualité."
"6,50",4.64,Ka'ré fourré chocolinette + - 375g,Epicerie,Grillon d'Or,"A consommer sans modération, pour bien commencer la journée !"
"7,30",5.09,Brosse à dents rechargeable vert sapin souple,Hygiène et beauté,Lamazuna,Brosse à dents avec tête rechargeable ! Elle existe dans divers coloris pour équiper toute la famille ! Adopter une démarche zéro déchet !
"3,49",2.44,Wasabi - 30 g,Epicerie,Lima,Apportez à vos plats de légumes une saveur supplémentaire en un clin d'oeil avec une pâte de Wasabi 100% biologique.
"20,00",15.99,Lait Priméa 1er âge 0-6 mois - 900 g,Bébé et enfant,Babybio,Babybio PRIMEA 1 est un lait pour nourrissons Bio élaboré en France avec du lait de vache d'origine française.
"3,76",2.73,"Soupe des Indes - 0,5 L",Epicerie,Karine & Jeff,"L'alliance de la légumineuse (lentilles corail) avec des légumes savoureux (courgettes, tomates, poivrons, oignons et petits pois), agrémentée d'un subtil mélange d'épices qui vous invite au voyage."
"3,80",2.68,Pur jus trois fruits du verger - 75cl,Epicerie,Vitamont,"Pur jus de fruits du verger, votre jus au gout des fruits du verger de France !"
"5,35",3.67,Spaghetti maïs - 500g,Epicerie,Nature et Compagnie,Le plaisir des spaghettis sans le gluten.
"3,50",2.40,Chips pétales de panais au romarin - 70 g,Epicerie,Croustisud,"Ce sont de petites chips produites à partir de panais finement découpés, frites à basse température et légèrement saupoudrés de romarin."
"2,24",1.65,Fructose - 500 g,Epicerie,Markal,"Le fructose est présent naturellement dans les fruits, leurs jus, le miel, le sirop d’agave.. Il est une excellente alternative naturelle au sucre de canne."
"4,20",3.09,Farine complète de grand Epeautre - 1kg,Epicerie,Celnat,"Idéal pour la panification, cette farine d’épeautre remplacera la farine de blé complète traditionnelle."
"1,90",1.38,Crème cuisine India - 20 ml,Epicerie,Ecomil,Rajoutez un petit goût d'épices dans vos plats !
"5,20",3.93,Denticlay Dentifrice thym - 75ml,Hygiène et beauté,Ciel d'Azur,"L'argile blanche est particulièrement recommandée en pâte dentifrice, extraits de Thym Bio, sel marin non raffiné - stimulant."
"8,29",6.00,Gel exfoliant visage 81% aloe vera - 150ml,Hygiène et beauté,Pur'Aloe,Les agressions quotidiennes obstruent les pores de la peau ce qui se traduit par l’apparition de points noirs et de boutons.
"6,15",4.36,Vernis 2 en 1 base et top coat - 10 ml,Hygiène et beauté,Santé,"Le vernis 2 en 1 Base et Top coat de SANTE est un indispensable d’une manucure parfaite. Utilisé en base, il protège les ongles et les renforce. Utilisé en Top coat, il apporte brillance et consolidation au vernis-couleur qui est apposé. Votre manucure est sublimée et dure plus longtemps."
"4,11",3.03,"Mouliné forestière - 0,5 L",Epicerie,Karine & Jeff,"Toutes les saveurs douces du potimarron, des champignons, des pommes de terre et de l'estragon, dans une soupe veloutée et peu salée."
"4,22",2.88,Cubes d'écorces d'orange confits - 150 g,Epicerie,La Patelière,Cubes d'écorces d'orange confites au sucre de canne. Idéal dans un cake ou un pudding.
"12,89",9.60,Açai cru en poudre - 50 g,Epicerie,Sol Semilla,"Fruit d’un palmier amazonienne aux vertues énergétiques et reconstituantes. Goût indéfinissable rappelant le cacao, le pruneau, la noisette... Cet açaï lyophilisé est selon Sol Semilla le plus pur du marché, la saveur subtile du fruit frais préservée !"
"5,00",3.65,Mayonnaise nature squeezer - 315g,Epicerie,Emile Noël,La 
"14,40",9.55,Huile végétale de Jojoba - 50 ml,Santé,Laboratoire du Haut Ségala,Cette huile améliore l'aspect des peaux grasses par son action équilibrante due à sa composition proche de celle du sébum humain. Elle est utilisée pour hydrater et protéger la peau.
"2,19",1.49,Fenouil graines - 30 g,Epicerie,Cook Arcadie,"Poissons, crustacés, légumes, cuisine provençale, court-bouillon, pâtisseries et liqueurs."
"13,00",9.24,Miel de fleurs d'Auvergne - 500g,Epicerie,Des milliers d'abeilles,Le 
"8,25",5.87,Démaquillant bi-phase yeux et lèvres - 100 ml,Hygiène et beauté,Santé,"Le démaquillant biphase aux huiles végétales précieuses nettoie la peau grâce aux tensioactifs doux. Enrichie en aloe vera et en eau de rose, la formule biphasée démaquille les yeux et les lèvres et nettoie la peau en douceur. La formulation avec l'extrait de bio de concombre laisse un parfum rafraîchissant sur le visage."
"12,55",10.03,Huile Bourrache Onagre - 120 capsules,Santé,Nat & Form,Complément alimentaire de 2 plantes riches en acide gras essentiels de type oméga 3 et 6.
"8,90",6.25,Huile essentielle Ylang Ylang Bio - 10 ml,Santé,Biofloral,Huile essentielle de lavande produite dans les montagnes d'Auvergne.
"7,50",5.36,Eau florale de lavande - 200 ml,Santé,Gravier,"L'eau florale de lavande est rééquilibrante, idéale pour les peaux grasses et mixtes. Astringent et purifiant, c'est aussi un ingrédient de choix pour les soins des peaux à imperfections."
"4,11",3.17,Nopal - 60 gélules,Santé,Nat & Form,Un des meilleurs coupe-faim et amaigrissant naturels.
"3,13",2.34,Ferment préparation kéfir de lait - 2x6 g,Epicerie,Natali,"Originaire de Caucase, le kéfir est une boisson pétillante à base de lait fermenté par des bactéries et des levures."
"24,90",18.79,"Perles de céramique spécial ""lave-vaisselle"" - x30",Tout pour la maison,Les verts moutons,"pour une vaisselle plus propre et plus brillante, même en diminuant la dose de détergent. C’est économique et écologique à la fois !"
"10,00",7.89,Shampoing cheveux secs karité jojoba aloé - 500 ml,Hygiène et beauté,Cosmo Naturel,"Ce shampooing a été spécialement formulé pour le soin des cheveux secs. Le karité, le jojoba et l'aloé vera s'associent pour nourrir le cheveu en lui apportant douceur et souplesse."
"3,25",2.29,Soupe lentilles corail et épices douces BIO 500 ml,Epicerie,Danival,Ambiance cocooning garantie avec cette recette fait-maison tendrement moulinée !
"11,20",8.24,Myrtilles séchées - 100 g,Epicerie,Biolo'klock,"Nos myrtilles séchées BIO, encas sain au goût savoureux, sont conditionnées dans un sachet pasteurisé de 100 grammes. Elles sont 100% françaises."
"6,00",4.28,Piment de Cayenne - 40 g,Epicerie,Cook Arcadie,Piment de Cayene
"5,25",3.92,Denticlay Dentifrice sauge - 75ml,Hygiène et beauté,Ciel d'Azur,"L'argile blanche est particulièrement recommandée en pâte dentifrice, extraits de Sauge Bio, sel marin non raffiné - tonique des gencives."
"7,01",5.09,Baume démêlant - 250 ml,Hygiène et beauté,Ciel d'Azur,Baume démêlant après shampoing à base de jojoba et d'inca inchi.
"3,17",2.40,Boisson végétale sésame - 1L,Epicerie,Ecomil,Une simple boisson végétale à base de sésame.
"2,50",1.76,Epinard géant d'hiver - 5g,Jardin,La belle potagère,"Variété tardive et savoureuse connue pour sa rusticité et sa résistance au froid, elle est caractérisée par de grandes feuilles larges, épaisses et croquantes."
"2,42",1.66,Confix'bio - 120 g,Epicerie,Natali,La préparation CONFIX’BIO réunit plusieurs ingrédients pour réussir à coup sûr sa confiture.
"4,57",3.43,Confiture extra de myrtille sauvage - 320g,Epicerie,Mamie Bio,Idéal pour accompagner votre petit déjeuner.
"6,14",3.67,Noix de muscade moulue - 35 g,Epicerie,Cook Arcadie,"Sauce béchamel, farces, gratins, purée de légumes. Se marie aussi bien au salé qu'au sucré."
"4,03",2.79,Cardamome poudre - 35 g,Epicerie,Cook Arcadie,"Pour la préparation de la cuisine indienne, pâtisseries, crèmes, compotes."
"16,50",10.58,VRAC - Lentilles corail Turquie,Epicerie,Aurore Market,"Les lentilles corail, une jolie couleur orangée et un goût incomparable !"
"6,30",5.02,Sirop d'agave - 350g,Epicerie,Artisans du monde,"Avec son bouchon doseur, vous pourrez mettre la juste dose de sirop d'agave."
"9,00",7.47,VRAC - Framboise enrobées de chocolat noir,Vrac,Aurore Market,L'alliance parfaite entre la douceur de la 
"15,70",12.50,Magnésium marin B6 B9 calcium - 100 gélules,Santé,Biotechnie,"Magnésium marin B6, B9 et calcium, pour une action durable et complète. Apport naturel en calcium et en magnésium."
"5,65",4.12,Muesli chocolat - 500 g,Epicerie,Grillon d'Or,Goûtez ce mélange de céréales associant de fondantes pépites de chocolat à de délicieuses noisettes grillées.
"5,90",4.66,Muesli au sarrasin - 500 g,Epicerie,Grillon d'Or,Laissez-vous tenter par ce muesli au sarrasin avec ses délicieux flocons de blé noir et ce sarrasin soufflé au miel.
"2,57",1.70,Assiette fondue de carotte mais doux quinoa dès 12 mois - 230 g,Bébé et enfant,Babybio,"Les papilles s'envolent avec cette recette aux accents d'Amérique Latine. Savoureuse, elle marie les graines de quinoa au maïs doux d'Aquitaine pour la fraîcheur et aux carottes landaises pour l'onctuosité. Avec ce plat, bébé embarque pour un bon voyage !"
"3,75",2.80,Petit pot maïs doux et poulet dès 8 mois - 2x200 g,Bébé et enfant,Babybio,"Accompagné de maïs doux d'Aquitaine et de carottes des Landes, notre poulet du Poitou ravira les papilles des petits gourmets. Avec ce plat, bébé est sûr de se régaler."
"13,03",8.90,Lait en poudre 3ème âge - 2x300g,Bébé et enfant,Holle,"À partir de 10 mois, à mesure que les besoins nutritionnels s’accroissent, le lait de suite 3 est plus adapté."
"2,50",1.76,"Souci des jardins - 1,5g",Jardin,La belle potagère,"Plante aux grosses fleurs comestibles, jaunes et orangées. Facile à cultiver, le souci repousse de nombreux parasites du jardin."
"10,80",8.18,Gel moussant 3 en 1 - 500 ml,Bébé et enfant,Alphanova,"Moussant 3 en 1 très doux est un soin cosmétique biologique pour la douche et le bain de bébé : il peut être utilisé comme gel lavant pour le corps, shampooing et aussi comme bain moussant"
"7,40",5.86,Déodorant Spray Brume active cardamome patchouli - 100 ml,Hygiène et beauté,Cattier,Un déodorant sans sels d’aluminium pour un bien-être et une fraîcheur au quotidien.
"6,43",5.13,Souchet épluché - 350 g,Epicerie,Ecoidées,"Ce tubercule très croquant se consomme tel quel, son goût délicieux ne se révéle qu’après l’avoir bien mastiqué ! Un délicieux goût d'amande sucrée !"
"9,90",7.42,Haricot saucisse - 800g,Epicerie,Mamie Bio,Un plat chaleureux et convivial prêt en quelques minutes.
"1,98",1.48,Disque à démaquiller cotton - x80,Hygiène et beauté,Silver Care,"Des disques à démaquiller en coton 100% biologique, sans parfum ni chlore."
"6,64",5.29,VRAC - Noisette chocolat noir,Epicerie,Aurore Market,Un 
"4,00",2.72,Sel rose gros - 750g,Epicerie,Place des épices,Le
"3,23",2.30,Twibio fourré tout chocolat - 150g,Epicerie,Moulin du Pivert,Biscuit gourmand au 
"4,00",2.72,Sel rose fin - 750g,Epicerie,Place des épices,Le
"2,30",1.59,Purée pêche jaune caseille dès 6 mois - 100 g,Bébé et enfant,Boulette et Gros Lapin,"Petit pot de pêche jaune et de casille, à déguster à partir de 6 mois fait avec amour par un maraîcher aveyronnais."
"10,00",7.72,Avoine germé cacao goji - 400 g,Epicerie,Iswari,"Ce mélange est un concept unique dans l’univers des petits déjeuners santé ! Ce sont des flocons d’Avoine crus, germés et sans gluten mélangés aux meilleurs ingrédients crus tel que le sarrasin et l’amande moulue ainsi qu’à des super-aliments tout aussi délicieux et nourrissants."
"7,30",5.09,Brosse à dents rechargeable bleue souple,Hygiène et beauté,Lamazuna,Brosse à dents avec tête rechargeable ! Elle existe dans divers coloris pour équiper toute la famille ! Adopter une démarche zéro déchet !
