base_price,discounted_price,product_name,category,brand,description
"4,50",2.78,Natte en bambou,Tout pour la maison,La finestra sul cielo,Indispensable pour la confection des sushis.
"9,80",8.23,Macon-chardonnay - Domaine Gérald Talmard - 2018,"Vins, bières et alcool",Domaine Gérald Talmard,Vin blanc 2018
"5,80",4.00,Huile essentielle Romarin provence - 10 ml,Santé,Biofloral,Huile essentielle de romarin cinéole produite dans les montagnes d'Auvergne.
"30,80",21.61,Huile essentielle Hélichryse italienne - 5 ml,Santé,Biofloral,Huile essentielle de hélicryse d'Italie produite dans les montagnes d'Auvergne.
"8,40",5.82,Huile essentielle Bergamote - 10 ml,Santé,Biofloral,Huile essentielle de bergamote produite dans les montagnes d'Auvergne.
"17,70",12.65,Mascara volume n° 01 noir - 7 ml,Hygiène et beauté,Santé,"Des cils de rêve ! Du volume, une courbure à l'extrême, une excellente tenue. Un mascara spécial aux sublimes couleurs terre."
"16,60",11.64,"Mascara définition parfaite n° 01 noir, 8 ml",Hygiène et beauté,Santé,Définition parfaite pour des cils longs et étoffés. Avec des pigments 100% naturels.
"11,00",8.24,Shampoing anti-pelliculaire au genévrier - 250 ml,Hygiène et beauté,Logona,"Le shampooing Antipelliculaire Logona traite les pellicules, rééquilibre le cuir chevelu et le soulage immédiatement."
"5,00",3.31,Cristaux d'Huile Essentielle Menthe - 10 g,Epicerie,Aromandise,Super pratiques ! Les 
"3,60",2.69,Infusion détente Massif Central - 30g,Epicerie,Ethiquable,
"5,46",3.31,Mélange apéritif - 180 g,Epicerie,Jean Hervé,Délicieux mélange de fruits secs à grignoter pour l'apéritif.
"17,00",12.48,Brosse wellfit à manche,Hygiène et beauté,Anaé,Brosse de massage à manche amovible. Idéal pour masser n'importe quelle partie de votre corps au quotidien.
"4,40",3.37,Confiture extra de pêche - 300 g,Epicerie,Biolo'klock,"Douce et parfumée, cette confiture est proposée dans un bocal en verre recyclable de 300 grammes."
"19,50",14.75,Crème solaire bébé SPF50+ spray - 125g,Hygiène et beauté,Alphanova,"Le lait solaire hypoallergénique SPF 50+ bio, végan et efficace d'Alphanova. Un produit indispensable pour que vos enfants aient une protection solaire maximale."
"3,60",2.69,Infusion détox Massif Central - 30g,Epicerie,Ethiquable,L'infusion detox à base de plante favorise
"6,34",4.64,Poivre blanc grain - 50 g,Epicerie,Cook Arcadie,Poivre blanc moulu sans moulin
"7,80",5.84,Rooibos & hibiscus - 80g,Epicerie,Artisans du monde,"Un rooibos délicatement parfumé grâce au moringa, au baobab, à la mangue, à l'ananas et la banane."
"4,10",2.91,Jus de légumes - 75cl,Epicerie,Vitamont,Votre jus de légumes au bon gout des légumes du jardin !
"2,50",1.65,Sachet Parfumé Rose de Bengale,Tout pour la maison,Aromandise,Ce 
"20,00",14.19,Farine complète de grand Epeautre - 5kg,Vrac,Celnat,"Idéal pour la panification, cette farine d’épeautre remplacera la farine de blé complète traditionnelle."
"4,90",3.31,Cristaux d'Huiles Essentielles Citron - 10g,Epicerie,Aromandise,Super pratiques ! Les 
"4,50",3.31,Farine blanche de grand épeautre - 1kg,Epicerie,Celnat,Farine raffinée pour la préparation de mets délicats.
"15,70",13.30,Bourgogne Pinot Noir - Domaine Vincent Legou - 2015,"Vins, bières et alcool",Domaine Vincent Legou,Appelation Bourgogne 2015
"8,94",6.42,Eau florale d'hamamélis - 200 ml,Santé,Gravier,L'eau florale bio d’hamamélis est reconnue pour ses propriétés astrigeantes et améliorer ainsi les rougeurs de peau. Elle est chargée en microparticules d'huiles essentielles et en principes actifs odorants.
"11,95",8.37,Huile essentielle Laurier noble - 10 ml,Santé,Biofloral,Huile essentielle de laurier noble produite dans les montagnes d'Auvergne.
"15,20",10.80,Huile Rose - 100 ml,Hygiène et beauté,Khadi,"Tout type de peaux - Aromathérapie à base d'huiles essentielles de palmarosa, jamrosa et géranium, cette huile procure un teint lumineux et frais."
"3,94",3.05,Gelée de coing - 235 g,Epicerie,Coteaux Nantais,Les amateurs de coings sauront reconnaître toute l'authenticité du fruit dans cette gelée au goût intense et raffiné.
"28,00",22.05,Crème de nuit redensifiante - parenthèse bucolique - 50 ml,Hygiène et beauté,Cattier,"Véritable cocon de nuit, le Soin de nuit redensifiant Cattier, à la texture onctueuse et fondante, procure une sensation immédiate de confort absolu."
"36,20",30.00,Champagne blanc de blancs brut,"Vins, bières et alcool",Robert Barbichon,Champagne blanc de blancs brut 
"16,00",12.56,VRAC - Spirales demi-complètes,Epicerie,Aurore Market,Les spirales blanches en vrac. Le bon gout des pates en vrac.
"11,90",8.10,Huile végétale de Calendula - 50 ml,Hygiène et beauté,Laboratoire du Haut Ségala,"Cette huile renforce les protections naturelles de l’épiderme, elle est adaptée aux peaux abîmées, fragilisées, gercées ou rougies. Elle agit efficacement contre les démangeaisons et les irritations. Apaisante et cicatrisante, elle soulage les brûlures et les coups de soleil et grâce à son action anti-inflammatoire, calme également les piqûres d’insectes et de méduse."
"2,50",1.76,"Courge Butternut - 2,5g",Jardin,La belle potagère,"Courge en forme de poire, à l'écorce crème et à la chair orangée, dense, fondante et savoureuse. Se conserve 6 à 12 mois."
"14,95",11.41,Teinture aux plantes noisettes - 100 g,Hygiène et beauté,Khadi,Pour un résultat entre le châtain moyen et le châtain foncé. Peut être associé avec les nuances Châtain Clair et Marron Foncé. Elle couvre les cheveux blancs en une seule application.
"18,00",12.84,Crème solaire adulte SPF30 - 125 ml,Hygiène et beauté,Alphanova,"Filtres 100% minéraux non nano, sans parabens, sans filtres chimiques, sans conservateurs chimiques."
"1,10",0.73,Boisson végétale avoine chocolat - 20 cl,Epicerie,Naturgreen,"Votre boisson avoine, saveur cacao, à emporter partout !"
"3,60",2.85,Bols mijoté de légumes poulet et quinoa dès 12 mois - 2x200 g,Bébé et enfant,Babybio,"S'il y a bien un qui règne sur les goûts dans ce plat, c'est le poulet fermier du Poitou. Carottes des Landes, poivrons d'Espagne et quinoa ne cessent de le flatter. Et même les tomates de la Drôme lui déroulent le tapis rouge. Avec ce plat bébé est plongé dans le royaume des saveurs !"
"6,90",4.25,Vanille bourbon gousse - x1,Epicerie,Place des épices,Magnifique vanille de Papouasie Nouvelle Guinée.
"3,10",2.35,Cannelle moulue - 50g,Epicerie,Place des épices,"De saveur aromatique chaude, sucrée et légèrement piquante, la cannelle est l’une des reines des épices depuis l’Antiquité."
"6,36",3.92,Denticlay Dentifrice romarin nettoyant - 75 ml,Hygiène et beauté,Ciel d'Azur,"L'argile blanche est particulièrement recommandée en pâte dentifrice, extraits de Romarin Bio, sel marin non raffiné."
"4,79",3.58,Quinoa à la Bolivienne - 350 g,Epicerie,Karine & Jeff,"Ce quinoa est cuit avec un assortiment de légumes (carottes, oignons, poivrons et tomates), le tout parfumé d'un subtil mélange d’épices. Peu de sel ajouté."
"7,76",6.00,Céréales Krounchy aux fruits - 1 kg,Epicerie,Grillon d'Or,"Le krounchy aux fruits est un mélange de céréales et de 5 fruits, avec juste ce qu'il faut de sucre de canne complet. Une recette classique qui ravira vos papilles dès le matin, à consommer sans modération au petit déjeuner !"
"3,78",2.55,Ferment préparation yaourt au bifidus - 2x6 g,Epicerie,Natali,"Pour bénéficier d’un effet positif sur votre flore intestinale, il est recommandé de consommer quotidiennement une dose comprise entre 1 et 5 milliards de bactéries probiotiques."
"4,45",3.23,Apibul pomme framboise - 75 cl,Epicerie,Coteaux Nantais,Douceur et acidité se mêlent dans ce pétillant qui accompagnera parfaitement vos apéritifs sans alcool et desserts.
"9,90",6.89,Shampoing solide cheveux gras herbes folles - 55 g,Hygiène et beauté,Lamazuna,Objectif zéro déchet
"3,45",2.54,Infusion ginseng - 17 sachets,Epicerie,Yogi Tea,Le message subtil de cette infusion est : « La paix intérieure et la confiance ».
"3,00",2.30,Flûtes olives et romarin - 125 g,Epicerie,Pural,Biscuits apéritifs originaux pour vos soirées endiablées !
"1,39",0.93,"Potabio - Potage ortie - 2x8,5 g",Epicerie,Natali,Préparation en poudre pour potage instantané à l’ortie.
"4,57",2.99,Graines à germer mix protéine - 200 g,Epicerie,Germ'line,"Composé à 100% de légumineuses, dont les propriétés sont reconnues, ce mélange est un régal pour le palais, et une réponse appréciables pour tous les adeptes de régimes végétariens, ou tout consommateur à la recherche de sources alternatives en protéines."
"1,12",0.82,Jus vita 12 fruits briquette - 20 cl,Epicerie,Vitamont,De délicieux fruits pressés dans une petite brique à emporter partout ! Pour faire le plein de vitamines dans toutes les activités sportives !
"2,40",1.86,Farine de blé T150 - 1 kg,Epicerie,Natur'avenir,La farine intégrale de référence ! La farine de blé T150 intégrale permet de conserver autant de nutriments que possible. Elle est souvent incorporée à plus petite dose dans les préparations.
"6,58",4.90,Cappelletti épinards emmental - 700 g,Epicerie,Karine & Jeff,Encore mieux que les raviolis.
"3,25",2.27,Boisson végétale au chanvre sans sucre - 1L,Epicerie,Ecomil,Le chanvre vous donne le meilleur ratio entre omega 6 et 3 !
"19,20",14.84,Café moulu Pérou - 1kg,Epicerie,Artisans du monde,Le café Pérou d'Artisans du Monde est un café d'altitude doux et très fruité aux réminiscences de chocolat noir.
"5,45",3.83,Bloc WC recharges - x4,Tout pour la maison,Arcy vert,"Nettoie, fait briller et désodorise."
"2,42",1.80,Petit pot pomme coing dès 4 mois - 2x130 g,Bébé et enfant,Babybio,"Cultivé sous le soleil qui leur convient, dans le respect de l'Agriculture Biologique, ces coings vont faire le bonheur des jeunes gourmands. Et quoi de mieux que les pommes d'Aquitaine pour en révéler toute la douceur ?"
"3,52",2.09,Poivronnade - 100 g,Epicerie,Danival,Tartinables à cuisiner ou tout simplement à déguster sur une tartine de pain grillée. Poivrons rouges du Sud-Ouest.
"9,92",6.72,Compote cool fruit pomme acérola - 12x90 g,Epicerie,Vitabio,Cool Fruits : les gourdes de fruits bio pour les enfants mais aussi pour les plus grands.
"3,26",2.41,Purée pomme abricot - 360 g,Epicerie,Coteaux Nantais,La douceur de la pomme relevée par une petite pointe acidulée de l’abricot.
"2,97",2.19,Arrowroot - 250 g,Epicerie,Celnat,"Fécule au fort pouvoir liant pour les potages, sauces et desserts."
"13,26",9.35,Huile d'olive vierge extra fruité vert - 1 L,Epicerie,Emile Noël,"Arômes d’artichaut cru, de tomates vertes voire d’herbes fraîchement coupées caractérisent notre huile fruité vert."
"5,30",3.72,Câpres - 130 g,Epicerie,Danival,"Délicieuses câpres au naturel à utiliser pour rehausser vos salades, vos sauces tomates ou encore légumes cuisinés."
"2,84",2.06,Sauce tomate Napolitaine - 255 g,Epicerie,Karine & Jeff,Parfait pour les pizzas !
"3,02",2.36,Flakes d'épeautre - 250 g,Epicerie,Grillon d'Or,"L'épeautre est reconnu pour ses propriétés énérgétiques et pour être très digeste, parfait pour bien démarrer la journée. Un petit déjeuner parfait pour bien démarrer vos journées."
"8,90",6.42,Déodorant en baume le poudré - Fleur d'oranger et lavande - 50 g,Hygiène et beauté,Clémence et Vivien,"Ce baume déodorant s'applique au doigt, comme une crème, sur les aisselles. Sa composition aux poudres et les synergies d'huiles essentielles utilisées lui confèrent efficacité et toucher non-gras.Il est évident que vous serez agréablement surpris(e) par ce produit à la gestuelle originale!"
"2,96",2.16,Flocons de sarrasin - 350 g,Epicerie,Celnat,Ces flocons précuits à la vapeur sont pratiques et faciles à utiliser.
"19,89",15.44,Purée d'amande blanche - 700 g,Epicerie,Jean Hervé,"La purée d'amande blanche élu ""meilleur produit bio de l'année 2017"", sera idéale pour vos desserts, vos plats cuisinés ou à tartiner tel quel."
"2,42",1.60,Boisson aloe vera - 350 ml,Epicerie,Organic Crunch,"Une boisson avec une saveur originale, douce et légèrement acide d'aloe vera. "
"0,90",0.72,Nougat - 30g,Epicerie,Artisans du monde,Parfait pour un petit creux !
"0,62",0.49,Barre de sésame - 20 g,Epicerie,Artisans du monde,Pour un quatre heure équitable et équilibré !
"4,25",3.37,Purée de sésame complet crue - 280 g,Epicerie,Perl'amande,"Découvrez la purée crue 100% sésame complet, un mélange savamment dosé entre finesse et onctuosité."
"2,16",1.58,Farine d'avoine demi-complète - 500 g,Epicerie,Celnat,La farine d'avoine demi-complète est notamment appréciée pour ses fibres solubles qui contribueraient à la réduction du taux de cholestérol et favoriseraient la perte de poids.
"3,82",2.86,Gourde pomme fraise vanille dès 6 mois - 4x90 g,Bébé et enfant,Babybio,"Pour sublimer les saveurs de la fraise, Babybio l'associe à la douceur des pommes d'Aquitaine et au parfum de la vanille Bourbon. Tous cultivés dans le respect de l'Agriculture Biologique, nos ingrédients emmènent votre enfant sur la route de nouvelles saveurs !"
"8,88",6.80,Huile salade crudité - 1 L,Epicerie,Bio Planète,"Combinant trois classiques parmi les huiles alimentaires majeures, elle vous accompagne au quotidien dans la préparation d'une alimentation visant à préserver votre santé grâce à sa richesse en oméga 3 et 6."
"1,10",0.77,Bioflan café - 10 g,Epicerie,Natali,"Préparation en poudre pour faire soi-même des entremets au café avec du lait ou du jus végétal comme le jus de soja, jus d'avoine..."
"3,42",2.48,Taboulé de quinoa - 180 g,Epicerie,Danival,"Un taboulé de quinoa agrémenté de fenouil et assaisonné de jus de citron, de piment et de vinaigre, prêt à consommer et facile à emporter pour faire le plein de saveur et profiter du soleil du Sud-Ouest où que vous soyez !"
"3,85",3.02,Lentilles blondes Flora Gascogne - 500g,Epicerie,Ethiquable,"Ces lentilles de variété Flora à la saveur douce et sucrée sont plus moelleuses que les lentilles noires ou vertes. Elles apporteront une petite touche très agréable aux salades, été comme hiver."
"10,50",8.30,Culotte d'apprentissage T5 12 à 20kg - x20,Bébé et enfant,Bambo Nature,"Bambo Nature, la nouvelle génération de couches pour enfants respectueuses de l'environnement !"
"7,90",5.62,Déodorant en baume le sucré - Ylang Ylang et cèdre - 50 g,Hygiène et beauté,Clémence et Vivien,"Ce baume déodorant s'applique au doigt, comme une crème, sur les aisselles. Sa composition aux poudres et les synergies d'huiles essentielles utilisées lui confèrent efficacité et toucher non-gras.Il est évident que vous serez agréablement surpris(e) par ce produit à la gestuelle originale!"
"2,37",1.72,Ail des ours coupé -16g,Epicerie,Cook Arcadie,Pour aromatiser tous vos plats
"18,49",13.87,Café en grain Pérou - 1 kg,Epicerie,Artisans du monde,Café torréfié moulu issu de l’agriculture biologique pour cafetière et machine expresso. Le café Pérou d’Artisans du Monde est un café d’altitude doux et très fruité aux réminiscences de chocolat noir.
"5,00",3.72,Liquide vaisselle main ultra concentré - 1 L,Tout pour la maison,Lérutan,Ce liquide vaisselle ultra concentré est idéale pour votre lavage à la main. Sans tensio-actif éthoxylé et ultra dégraissant votre vaisselle sera propre et brillante!
"4,56",3.36,Confiture extra de fraise - 325 g,Epicerie,Coteaux Nantais,Une confiture qui séduit l'œil et les papilles avec le bon goût des morceaux de fraises bien mûres.
"5,10",3.70,Argile blanche ultra ventillée - 200 g,Hygiène et beauté,Argiletz,"L’argile blanche kaolinite est ultra douce, d'un pH plus neutre, utilisée pour ses propriétés décongestionnantes.Cette argile blanche kaolinite neutre respecte votre épiderme, même sensible, tout en lui apportant une douceur infinie."
"14,50",11.49,Sucre de fleur de coco - 1 kg,Epicerie,Comptoirs et compagnies,"Ce sucre de coco bio est produit à partir du nectar des fleurs de ""l'arbre de vie"" tel qu'on le surnomme aux Philippines."
"5,00",3.65,Cannelle poudre - 80 g,Epicerie,Cook Arcadie,Cannelle moulue
"11,60",8.49,Farine de blé blanche T65 - 5 kg,Vrac,Celnat,"La farine de blé blanche type 65 est donc moins riche d’un point de vue nutritif mais sera appréciée pour sa finesse qui vous permettra de réaliser les mets les plus délicats, notamment des pâtisseries."
"1,50",1.00,"Potabio - Potage thaï - 2x8,5 g",Epicerie,Natali,Préparation en poudre pour potage instantané thaï.
"10,35",7.80,Huile de colza désodorisée - 1 L,Epicerie,Bio Planète,"Huile de colza, spéciale sauces et mayonnaises. 100 % végétale, elle remplacera avantageusement le beurre dans l’élaboration de sauces chaudes."
"6,86",5.06,Sucre mascobado - 1 kg,Epicerie,Artisans du monde,"Le sucre Mascobado bio est un sucre de canne complet, au léger goût de caramel, issu d’un processus de fabrication artisanal. Il se caractérise par sa couleur brune."
"3,19",2.47,Purée pomme cassis - 360 g,Epicerie,Coteaux Nantais,"Le cassis aigrelet sortant tout droit des terroirs d'antan, donne du caractère au duo en rehaussant l’arôme de la pomme."
"2,97",2.17,Sauce tomate aux carottes et basilic - 255 g,Epicerie,Karine & Jeff,Une belle sauce relevée par des légumes et des aromates.
"18,57",13.97,Liquide vaisselle citron - 5L,Tout pour la maison,Ecover,
"12,07",9.09,"Lessive liquide zéro - 1,5 L",Tout pour la maison,Ecover,Ecover 0% a été spécialement conçu pour un lavage de qualité exceptionnelle. Pour tous ceux qui veulent un produit sans parfum et sans colorant.
"3,18",2.36,Biscuits banane pépite de chocolat - 130 g,Epicerie,Dao,Cette toute nouvelle gamme de biscuits spécialement conçue pour les petits (et les grands !) contient au minimum 30 % de sucre en moins par rapport à la moyenne de biscuits enfants sur le marché et ils sont si savoureux que vous n’allez pas vous en apercevoir !
"3,27",2.52,Keeny aux pépites de chocolat - 150g,Epicerie,Bio Soleil,"Passez un moment de plaisir en dégustant ces Keeny Bio aux pépites de chocolat équitable, sans huile de palme!"
"2,51",1.80,Petit pot pomme pruneaux dès 4 mois - 2x130 g,Bébé et enfant,Babybio,"L'avantage du pruneau, c'est que son goût très doux et sucré plait aux tout-petits. Et quand il vient d'Aquitaine où il a été cultivé dans le respect de l'Agriculture Biologique, on ne peut qu'en redemander!"
"2,00",1.53,VRAC - Graines de tournesol,Vrac,Aurore Market,"Pour donner une touche de gaieté à vos salades ou simplement pour vos appéritifs, la graine de tournsol est toujours là pour vous apporter ses nutriments."
"1,39",0.80,Infusion glacée hibiscus litchi - 33cl,Epicerie,Ethiquable,A consommer bien frais :)
"5,95",4.30,Céréales Krounchy trois chocolats - 500 g,Epicerie,Grillon d'Or,"Laissez-vous tenter par ce délicieux mélange de pépites de céréales complètes dorées au four associées à des morceaux de chocolat noir, de chocolat au lait et de chocolat blanc."
"1,11",0.83,Pur jus d'orange briquette - 20 cl,Epicerie,Vitamont,Le plus basique de tous les jus !
"3,33",2.32,Biscuits tentation orange - 130 g,Epicerie,Moulin du Pivert,"L’instant détente avec ce biscuit enrobée de chocolat noir aux écorces d'orange confites. Pour encore plus de saveurs, Le Moulin du Pivert ajoute une pointe d’huile essentielle d’orange biologique provenant d’une entreprise locale. Bonne dégustation !"
"3,50",2.53,Infusion profonde respiration - 17 sachets,Epicerie,Yogi Tea,Le message subtil de cette infusion est : « La respiration est la vie »
"3,52",2.54,Boisson végétale amande original - 1L,Epicerie,Ecomil,Une autre déclinaison de la boisson végétale à l’amande bio avec du sirop d’agave !
"4,35",3.07,Haricots rouges de France - 500g,Epicerie,Celnat,Riche en protéines végétales.
"4,58",3.58,Café grains Congo - 250 g,Epicerie,Ethiquable,"Cette version grain spécialement conçue pour les machines à café à moulin libère les arômes floraux du café du Congo, un des plus grands arabicas africains."
"1,10",0.83,Jus cocktail junior briquette - 20 cl,Epicerie,Vitamont,De délicieux fruits pressés dans une petite brique à emporter partout ! L'allié indispensable de tous les goûters !
"3,56",2.60,Petits pots carotte courge butternut et riz dès 6 mois - 2x200 g,Bébé et enfant,Babybio,"En grandissant les pieds dans le sable et la tête caressée par l'air marin, la carotte des Landes a développé un goût délicatement parfumé et légèrement sucré qui enchantera bébé ! Babybio l'a alliée aux saveurs de la courge butternut pour obtenir un petit plat savoureux."
"3,82",2.80,Petit pot carotte courge butternut poulet riz dès 6 mois - 2x200g,Bébé et enfant,Babybio,"Avec ses carottes cultivées dans le sol sablonneux des Landes, ses courges butternut de Provence et son poulet fermier du Poitou, voilà un petit pot qui respire le bon goût du terroir ! Accompagné de riz et rehaussé d'une pointe de thym, ce plat fera le bonheur des tout-petits."
"16,45",12.26,Café moulu Honduras - 1 kg,Epicerie,Ethiquable,"Arabica moulu de haute altitude, intense et parfumé"
"5,61",3.88,Muesli de céréales germées chocolat noisette - 375 g,Epicerie,Germ'line,"Pour préserver tous leurs bienfaits, les céréales ont été déshydratées par technologie douce, puis mélangées à des ingrédients rigoureusement séléctionnés pour leurs qualités nutritionnelles et gustatives."
"1,12",0.77,Bioflan noix de coco - 8 g,Epicerie,Natali,"Préparation en poudre pour faire soi-même des entremets noix de coco avec du lait ou du jus végétal comme le jus de soja, jus d'avoine..."
"8,03",6.20,Chocolat en poudre - 500 g,Epicerie,Vitabio,"Pour bien démarrer la journée, rien de tel qu'un bon petit déjeuner ! Oui,mais complet et équilibré !"
"4,10",3.08,Thon blanc Germon à l'huile d'olive - 52 g,Epicerie,Phare d’Eckmuhl,Fin et moelleux.
"3,84",2.88,Barre cranberry fruits des bois - 6 barres,Epicerie,Bio Soleil,"Barres de céréales aux cranberry et fruits des bois, sans huile de palme, facile à transporter elles sont idéales pour les petits creux en journée !"
"8,58",6.36,Yannoh instant sachet écorecharge - 250 g,Epicerie,Lima,"Le Yannoh Instant est une alternative instantanée au café, il s'agit d'une délicieuse boisson sans caféine, fabriquée à partir de céréales torréfiées (orge et seigle), avec de la chicorée et des glands."
"3,02",1.99,Soja jaune dépelliculé - 500 g,Epicerie,Celnat,"Le soja jaune dépelliculé vous permettra réaliser des produits fermentés comme le tempeh ; le soja étant l’ingrédient de base de nombreux produits fermentés tels que le shoyou et le tamari (sauces de soja), le miso."
"7,65",5.11,Baies de goji - 125 g,Epicerie,Comptoirs et compagnies,"Utilisées depuis des millénaires dans les pharmacopées tibétaines et chinoises, le goji est un superfruit naturellement riche en vitamine C reconnue pour son pouvoir antioxydant. Il est également source de calcium et riche en fer qui contribue à réduire la fatigue."
"5,00",3.49,Pot de rangement pour cosmétiques solides,Tout pour la maison,Lamazuna,Pot en verre inspiré des Mason Jars américaines avec un couvercle en métal joliment perforé en forme de marguerite. Idéalement conçu pour ranger vos cosmétiques solides il vous sera indispensable.
"5,00",3.53,Miel de niaouli - 250 g,Epicerie,Ethiquable,"Le parfum prononcé de ce miel de caractère est lié au Niaouli, un arbre de la famille des Eucalyptus très mellifère."
"1,30",0.96,Pur jus d'ananas briquette - 20 cl,Epicerie,Vitamont,De délicieux ananas pressées dans une petite brique à emporter partout ! Une dose d'exotisme et de fraîcheur à tous moments de la journée !
"3,90",2.79,Mangues séchées - 80 g,Epicerie,Supersec,"Délicieuse Mangue séchée bio sans gluten. Moins d'eau, plus de goût !"
"3,28",2.29,Twibio fourré aux fraises - 150 g,Epicerie,Moulin du Pivert,"Faites place à la simplicité naturelle avec ce délicieux Twibio fourré aux fraises. En sachet individuel, vous pouvez les glisser facilement dans une poche ou un cartable. A chacun son goût, à chacun son Twibio !"
"3,20",2.29,Twibio fourré à la myrtille - 150 g,Epicerie,Moulin du Pivert,"Laissez vous surprendre par le goût légèrement acidulé de ce délicieux Twibio aux myrtilles. En sachet individuel, vous pouvez les glisser facilement dans une poche ou un cartable. A chacun son goût, à chacun son Twibio !"
"3,62",2.67,Chocolat noir tradition 95% - 90 g,Epicerie,Dardenne,"Chocolat puissant par excellence, grâce à sa teneur élevée en cacao, régalez vous avec ce délicieux chocolat noir !"
"3,10",2.08,Olivade noire - 100 g,Epicerie,Danival,À tartiner sur vos bruschetta ou à déguster frais !
"6,64",5.29,VRAC - Amandes au chocolat noir,Vrac,Aurore Market,Pour les gourmands qui font attention à leur santé.
"2,10",1.55,Boite de mouchoirs - 80,Hygiène et beauté,Renova,Boîte de mouchoirs en papier recyclé
"3,10",2.47,Papillons petit épeautre aux oeufs frais - 250 g,Epicerie,Lazzaretti,Le petit épeautre de provence est idéal en salades mais aussi pour accompagner des préparations mijotées ou plats traditionnels.
"3,21",2.24,Plaisir noisette au chocolat noir - 130g,Epicerie,Moulin du Pivert,"Parce que le plaisir se partage, ces biscuits se présentent en sachet individuel par 2. A emporter partout et à faire découvrir ou redécouvrir tout au long de la journée."
