base_price,discounted_price,product_name,category,brand,description
"1,31",0.89,Tomates concassées - 400 g,Epicerie,La Bio Idea,Les tomates concassées en conserve La Bio Idea seront indispensables pour toutes vos recettes à base de tomates.
"3,56",2.53,Filets de sardines à l'huile d'olive bio - 70 g,Epicerie,Phare d’Eckmuhl,Filets de sardines à l'huile d'olive vierge extra bio
"0,85",0.60,Levure de boulanger vegan et sans gluten - 9 g,Epicerie,Pural,La poudre à lever de boulanger sera idéale pour la fabrication de vos pâtisseries.
"2,17",1.45,Boisson végétale à base de riz - 1 L,Epicerie,Lima,"Il y a plus de 20 ans, Lima lançait la première boisson au riz en Europe, le Rêv'Riz. Aujourd'hui rebaptisé Rice Drink Original, il est toujours LA référence. Il se distingue d'une boisson nature par une très légère touche de vanille qui lui confère sa saveur unique. Le goût naturellement sucré de cette boisson fraîche a conquis toutes les générations à tout moment de la journée."
"3,60",2.85,Chocolat noir dessert 60% - 200 g,Epicerie,Ethiquable,Ce chocolat noir dessert de la marque Ethiquable sera rendre vous faire fondre de gourmandise !
"3,22",2.18,Logodent Dentifrice à la menthe daily care - 75 ml,Hygiène et beauté,Logona,Ce dentifrice à la menthe bio offre une mousse légère qui nettoie en douceur les dents et des gencives. L'extrait de camomille bio a un effet anti-inflammatoire et soignant.
"1,41",0.91,Tomates pelées - 400 g,Epicerie,La Bio Idea,La tomate pelée est un ingrédient de base pour la préparation de sauces.
"2,00",1.32,Passata nature - 690 g,Epicerie,La Bio Idea,La Passata nature est un ingrédient de base qui sera idéale pour élaborer toutes vos recettes de sauce tomate.
"4,43",3.27,Thon albacore au naturel - 112 g,Epicerie,Phare d’Eckmuhl,Thon au naturel pêché à la ligne
"1,45",1.06,Crème cuisine lait de coco - 20 cl,Epicerie,Ecomil,Préparation culinaire au lait de coco
"2,44",1.69,Boisson végétale avoine calcium - 1 L,Epicerie,Lima,"Le Oat Drink Calcium est une boisson végétale savoureuse, produit selon une recette entièrement naturelle. Elle s’utilise comme boisson chaude ou froide et dans la confection de nombreux plats sucrés ou salés en remplacement du lait."
"2,08",1.50,Boisson végétale riz natural calcium - 1 L,Epicerie,Lima,"Une boissons enrichie qui se prête à toutes les utilisations. 200ml de Rice Drink Calcium procurent 15% des apports journaliers recommandés en calcium, comme ça vous pourriez fournir votre organisme du calcium dès le petit déjeuner. En plus sans sucres ajoutés, sans lactose et sans gluten!"
"1,60",1.20,Lait demi-écrémé - 1L,Epicerie,Natur'avenir,Lait de vache bio demi-écrémé stérilisé UHT.
"1,03",0.71,Soja cuisine - 20 cl,Epicerie,Lima,"Alternative végétale à la crème liquide sans lécithine pour une cuisine simple, salée ou sucrée. La pointe de vanille apporte une saveur équilibrée et neutralise le goût du soja."
"6,29",4.44,Tablettes lave vaisselle - x25,Tout pour la maison,Ecover,Élimine fiablement la graisse et les saletés.
"3,74",2.63,Cookies fourrés au chocolat noir - 175 g,Epicerie,Moulin du Pivert,Ce biscuit fourré au chocolat noir et parsemé de pépites de chocolat fera le bonheur des fans de croquants. Prenez le temps de résister… pour finir par les picorer jusqu’à la dernière bouchée !
"34,00",26.50,Masque et gommage visage 2 en 1 - 30ml,Hygiène et beauté,Naturae Bioty,Le masque et gommage 
"42,00",32.83,Fluide hydra mat - 30ml,Hygiène et beauté,Naturae Bioty,Harmonie
"5,00",3.74,Confiture de banane 79% - 250g,Epicerie,Artisans du monde,"Plus qu'une confiture, car elle contient 79% de fruit pour seulement 20% de sucre de canne complet, la spécialité de banane fera même fondre vos tartines !"
"8,55",5.68,Fleurs de Bach Eau de Roche n°27 - Granules - 10 ml,Santé,Biofloral,"Changement positif : ouverture d'esprit, compréhension, souplesse."
"8,55",5.68,Fleurs de Bach Moutarde n°21 - Granules - 10 ml,Santé,Biofloral,"Changement positif : dépassement de la mélancolie, retour à la joie."
"19,00",13.55,"CC Crème n° 30 bronze, 30 ml",Hygiène et beauté,Santé,"Maquillage et soin en un seul produit ! 6 en 1, cette crème correctrice 30 Bronze apporte un soin à la peau et unifie le teint de manière naturelle."
"8,00",6.30,Pain d'épice orange - 190g,Epicerie,Artisans du monde,Pour encore plus de saveur.
"17,00",12.10,Shampoing traitant à la propolis - 125 ml,Hygiène et beauté,Ballot Flurin,"Pour le traitement des pellicules et des parasites, choisissez une solution naturelle avec le shampoing traitant à la propolis."
"10,00",7.89,Gel bain et douche lavandin de Provence - 500 ml,Hygiène et beauté,Cosmo Naturel,"Ce gel à la mousse délicate, est un soin quotidien au Lavandin de Provence pour le bain et la douche, spécialement élaboré pour nettoyer votre peau en douceur."
"10,30",7.56,Reine des prés - 200 gélules,Santé,Nat & Form,Pour les états fébriles ou les articulations douloureuses.
"39,00",29.25,T-shirt femme manches courtes col V - Noir,Vêtements,Le T-shirt propre,"Un tee-shirt Propre, c'est : Made in France et 100% coton BIO."
"13,45",9.84,Levure de riz rouge Bio - 120 gélules,Santé,Nat & Form,"La levure de riz rouge de Nat & Form est standardisée à 600mg et 1,6% de monacoline K soit 10mg / gélule."
"8,30",6.46,Eau florale de genévrier - 200 ml,Santé,Eolesens,"Diurétique, anti-rhumatismale, régulatrice et purifiante des peaux grasses."
"2,10",1.14,Airchips - pétale pomme de terre - 30g,Epicerie,Airchips,"Les airs chips une alternative unique aux chips. Sans friture, sans gluten, allégées en matières grasses ils seront vous faire plaisir."
"3,50",2.36,Cosmopolitan sans alcool - 75cl,"Vins, bières et alcool",Vitamont,"Pour un apéro estival, essayez le coktail cosmopolitan et ajoutez-y un peu de rhum pour plus de fun."
"39,00",29.25,T-shirt femme manches courtes col V - Bordeaux,Vêtements,Le T-shirt propre,"Un tee-shirt Propre, c'est : Made in France et 100% coton BIO."
"19,90",12.32,Couche lavable Pea Cherry - S,Bébé et enfant,P'tits dessous,La couche hybride Petit Pea coloris gris-prune s'utilise avec un insert réutilisable ou à usage unique (à retrouver 
"2,95",2.21,Haricot nain fin Slendrette - 50g,,La belle potagère,"Variété naine produisant des gousses de 10 à 12 cm de long sans fil. Goût fin très apprécié, de la famille des légumineuses, le haricot fixe l'azote dans le sol pour les cultures suivantes."
"4,90",3.06,Encens indien oliban - 20 bâtons,Tout pour la maison,Aromandise,L’encens Oliban apaise dans les moments de doute.
"3,00",1.91,Encens découverte Cèdre - 12 bâtonnets,Tout pour la maison,Aromandise,Découvrez un encens aux notes 
"12,90",9.11,Baume au calendula - 30 ml,Hygiène et beauté,Naturellement simples,Pour les peaux les plus fragiles et abimés.
"9,50",6.99,Spray démêlant familial - 200 ml,Hygiène et beauté,Cattier,Le 
"16,10",11.65,Lotion après-rasage - 100 ml,Hygiène et beauté,Logona,"Cette lotion après-rasage aux principes actifs anti-inflammatoire calme la peau. Au parfum épicé et boisé, elle revitalise et rafraîchit après le rasage."
"5,50",3.35,Encens indien rose - 12 cônes,Tout pour la maison,Aromandise,Cet encens est idéal pour calmer les petites angoisses et retrouver un peu de douceur dans le quotidien.
"18,45",15.57,Couches jetables T5 - x40,Bébé et enfant,Love & Green,Les
"11,43",8.31,Boisson Brûleur Draineur Bio 300 ml,Santé,Biotechnie,Ligne B Brûleur / Draineur a été spécifiquement formulé pour aider à combattre les excès de poids et stimuler les fonctions d’élimination de l’organisme. Sa formule est composée d’extraits de plantes issues de l’Agriculture Biologique.
"4,76",3.65,Kakis - 80 g,Epicerie,Supersec,"Kaki moelleux de Valence, séché bio et sans gluten. Moins d'eau, plus de goût !"
"2,50",1.76,"Chou coeur de boeuf des vertus - 0,4g",,La belle potagère,Chou à pomme pointue de très bonne qualité gustative. Variété rustique au feuillage abondant et au goût très fin.
"7,94",5.03,Fondue au chocolat noir - 180g,Epicerie,Bovetti,Une fondue au chocolat à tomber !
"3,95",2.92,Spray dégraissant multi-surface au savon noir - 500ml,Tout pour la maison,Fourmi verte,Le dégraissant multi-surface de la fourmi verte. Une fourmi avec laquelle vous allez ménagez votre maison. Ce dégraissant multi-surface au savon noir une alternative propre pour dégraisser toutes vos surfaces.
"8,99",6.97,Petit Bouddha pomme banane - 300 g,Epicerie,Iswari,"Les mélanges “Petit Bouddha” offrent des petits déjeuners complets, équilibrés et sains conçus pour les enfants. En plus de la préparation avec de l’eau ou une boisson végétale, ces mélanges peuvent être utilisés dans la confection d’autres recettes comme : shakes, crêpes, muffins, gâteaux,…"
"13,45",9.54,Blush multi effets 02 Cranberry - 8 g,Hygiène et beauté,Santé,"Le blush multi-effets SANTE 02 Cranberry est le nouvel allié bonne mine qui donne de l’éclat au teint. Riche en huile de ricin bio, sa formule adoucit la peau et le mica apporte un effet irisé au maquillage."
"19,45",13.83,"Poudre compacte n° 02 beige sable, 9 g",Hygiène et beauté,Santé,"La poudre compacte N°02 Light Beige c'est l'élégance par excellence ! Effet sublime grâce à des pigments minéraux ultrafins. Pour un teint velouté et transparent, harmonieux et légèrement mat."
"10,58",7.56,Pissenlit - 200 gélules,Santé,Nat & Form,Pissenlit à l'action drainante et éliminatrice de toxines.
"3,20",2.35,Protège-slips hypoallergéniques flexi - x28,Hygiène et beauté,Love & Green,"Des protège-slips qui s'adaptent à vos sous-vêtement, pour être libre de porter ce que vous voulez même pendant vos règles !"
"30,00",25.31,Junéo chèvre - lait de croissance 3eme âge 12 à 36 mois - 900g,Bébé et enfant,Juneo,Le lait de croissance de 12 à 36 mois Junéo est composé de lait de chèvre avec DHA et probiotique le tout sans huile de palme.
"3,95",2.92,Spray anti-calcaire au vinaigre de cidre - 500cl,Tout pour la maison,Fourmi verte,Le spray anticalcaire de la fourmi verte. Une fourmi avec laquelle vous allez ménagez votre maison. Ce liquide au vinaigre de cidre bio est une alternative propre pour entretenir vos équipements et ustensile sensible au calcaire.
"5,50",3.58,Tisane bonne nuit - x 20 sachets,Epicerie,Aromandise,"Infusée, elle devient une tisane apaisante au goût astringent et à l’arôme léger !"
"3,80",2.75,Eau d'érable - 50cl,Epicerie,Vitamont,Idéal pendant ou après un effort physique.
"15,60",10.90,Huile végétale Nigelle - 50 ml,Santé,Laboratoire du Haut Ségala,L'huile végétale de nigelle ou cumin noir est idéale pour les peaux sensibles.
"29,00",23.64,Lait caprea 1 nourrisson 0-6 mois - 900g,Bébé et enfant,Babybio,Le lait nourrisson Caprea 1 au lait de chèvre permet en complément d'une alimentation diversifiée de répondre aux besoins nutritionnels et physiologiques de votre bébé de 0 à 6 mois.
"4,85",3.58,Risotto aux cèpes - 250g,Epicerie,Autour du riz,"Le risotto aux cèpes d’Autour du riz, du bon riz italien préparé avec des champignons savoureux. Cette préparation risotto est agrémentée de "
"2,50",1.76,"Courge longue de Nice - 2,5g",Jardin,La belle potagère,"Courge aux fruit de 80 cm de longueur, à la chair dense, orangée et très savoureuse."
"39,00",29.25,T-shirt homme manches courtes - Blanc + poche marinière,Vêtements,Le T-shirt propre,"Un tee-shirt Propre, c'est : Made in France et 100% coton BIO."
"11,50",8.14,Fond de teint liquide effet mat 02 Sand - 30 ml,Hygiène et beauté,Santé,Le fond de teint liquide 02 Sand effet mat SANTE est enrichi en minéraux naturels et en pigments réfléchissants qui subliment le teint par un voile soyeux. La peau est matifiée grâce à l’Evermat TM .
"10,93",8.66,Curcuma plus articulation - 60 comprimés,Santé,Biotechnie,"Le curcuma, également connu sous le nom de safran des Indes, est une épice très réputée dans le sud de l’Asie."
"7,65",5.93,Eau florale de tilleul - 200 ml,Santé,Eolesens,"Adoucissante, décongestionnante et tonifiante cutanée. Anti-stress. Sédative et digestive."
"12,15",8.68,"Crayon à paupières kajal n° 06 marron, 1,1 g",Hygiène et beauté,Santé,"En un seul geste, le crayon kajal No.06 Marron apporte intensité et profondeur au regard."
"11,40",7.30,Gel nettoyant visage pour homme - 75 ml,Hygiène et beauté,Florame,Ce Gel Nettoyant aux Huiles Essentielles Bio et à l'Huile d'Argan Bio nettoie votre peau en profondeur et la prépare au rasage.
"17,55",12.44,Huile de soin capilaire tonifiante - 100 ml,Hygiène et beauté,Khadi,"Ralentit la chute des cheveux et prévient le grisonnement. Cheveux brillants et racines renforcées cette huile rend le cheveu plus souple. Se combine avec le shampooing amla, il est conseillé de l'utiliser en alternance avec l'huile capillaire revitalisante."
"5,17",3.86,Huile de soja - 50 cl,Epicerie,Emile Noël,Cette huile de première pression à froid a été extraite à partir de fèves de soja.
"3,44",2.54,Classic - 17 sachets,Epicerie,Yogi Tea,Goûter à la puissance et la chaleur de l'Inde avec le thé YOGI TEA Classic.
"13,00",8.28,Vin rouge AOP Languedoc - Le 5 Montpeyroux - Le mas de bertrand - 2016,"Vins, bières et alcool",Le mas de bertrand,"Le 5, un Languedoc souple et séducteur. Ce vin rouge sera s'allier à vos viandes en sauces et viandes épicées."
"9,00",7.20,Thé noir de Noël -100g,Epicerie,Artisans du monde,"Thé noir de Noël bio et équitable aux fruits, épices et fleurs. Ce délicieux thé noir est à déguster tout au long de la journée, seul ou accompagné de chocolats ..."
"6,48",5.50,Crème hydratante visage et corps - 500ml,Bébé et enfant,Love & Green,La
"5,95",4.19,[date courte] Bonhomme de neige en chocolat lait et son moule à réutiliser,Offrir,Bovetti,Un adorable Bonhomme de neige en chocolat au lait et son moule à réutiliser.
"3,60",2.59,Risotto complet aux cèpes - 250g,Epicerie,Autour du riz,"Le risotto complet aux cèpes d’Autour du riz, du bon riz préparé avec des champignons savoureux. Cette préparation risotto est agrémentée "
"12,47",7.56,Cassis - 200 gélules,Santé,Nat & Form,"Profitez des actions anti-inflammatoires du cassis, en gélules."
"12,90",9.74,"Perles de céramique spécial ""vases"" - x15",Tout pour la maison,Les verts moutons,Pour conserver tous vos bouquets de fleurs coupées jusqu’à trois fois plus longtemps.
"9,96",7.58,Shampoing color reflex à la noisette - 250 ml,Hygiène et beauté,Logona,Ce shampooing reflets à la noisette bio apporte brillance et rehausse l’éclat des cheveux châtains à bruns. Ses bases lavantes composées de sucre nettoient en douceur. Il prolonge l’éclat de la coloration végétale Logona.
"9,00",6.46,Farine complète 5 céréales - 3 kg,Epicerie,Celnat,Une farine complète et riche en goût.
"14,70",9.32,Kajal vert Rajasthan - 3 g,Hygiène et beauté,Soultree,"Le Kajal n°002 Vert Impérial est magnifique sur des yeux de couleur marron. Le soir venu, utilisez-le en aplat sur toute la paupière puis tracez un trait d'eyeliner avec le kajal Or Lakshmi. Succès garanti !"
"4,50",3.42,Gelée de groseille - 180 g,Epicerie,Biolo'klock,Celle succulente gelée de groseilles est conditionnée dans un bocal en verre recyclable de 180 grammes .
"7,00",4.62,Tétine caoutchouc naturel 3 à 24 mois - x2,Bébé et enfant,Hevea,La meilleure tétine non toxique. Pour bébés de 3 à 24 mois.
"3,50",2.47,Confiture citron - 320g,Epicerie,Mamie Bio,La confiture de citron pour tous vos plaisirs tartines !
"12,90",9.11,Baume à la consoude - 30 ml,Hygiène et beauté,Naturellement simples,"Ce baume aidera votre peau à cicatriser. En cas de plaie, de brûlure, d'ulcère, de gerçure, de crevasses du mamelon, de cicatrices ou de vergetures récente, ce baume facilitera la cicatrisation de votre peau."
"10,12",7.19,Crème mains 50% aloe vera - 100ml,Hygiène et beauté,Pur'Aloe,Cette combinaison donne une crème de traitement parfaite pour vos mains desséchées et abîmées.
"6,00",4.17,Huile essentielle Romarin Camphré - 10 ml,Santé,Biofloral,Huile essentielle de romarin camphré produite dans les montagnes d'Auvergne.
"10,52",7.89,Lash balm sérum révitalisant cils - 5 ml,Hygiène et beauté,Santé,De cils tout en beauté ! Soin délicat pour les cils.
"9,90",6.94,Huile essentielle Sauge sclarée - 5 ml,Santé,Biofloral,Huile essentielle de sauge sclarée produite dans les montagnes d'Auvergne.
"5,75",4.07,Fard à paupières 04 Brownish Taupe - 2 g,Hygiène et beauté,Santé,Le fard à paupières mono couleur SANTE délivre une couleur intense grâce à ses pigments minéraux naturels. Illuminez vos paupières d’un bois de rose mat avec le N°4 Brownish Taupe.
"15,90",11.59,Crème teintée claire SPF50+ - 50g,Hygiène et beauté,Alphanova,"Le crème teinté claire SPF 50+ bio, végan et efficace d'Alphanova. Un produit indispensable pour avoir une teinte de peau adapté et une protection solaire maximale."
"3,50",2.47,Bananes séchées - 100g,Epicerie,Artisans du monde,"Parmis les fruits séchés, testez les bananes criollo toujours plus moelleuses et exotiques !"
"4,40",3.16,Haricot vert agneau dès 10 mois - 240g,Bébé et enfant,Boulette et Gros Lapin,"Avec ses morceaux fondants, ce petit pots aux haricots vert et à l'agneau est parfaitement adapté dès 10 mois."
"14,72",10.90,Masque sublime kératine - 150ml,Hygiène et beauté,Coslys,"Masque spécial cheveux fragilisés & indisciplinés, repulpe, répare et lisse les cheveux"
"3,00",1.91,Encens découverte Yuzu - 12 bâtonnets,Tout pour la maison,Aromandise,"Découvrez un encens aux agrumes incontournable de la cuisine japonaise, le Yuzu étonne par ses notes hespéridées à mi-chemin entre la mandarine, le pamplemousse et le citron vert."
"5,10",3.78,Coussinets d'allaitement - x30,Hygiène et beauté,Silver Care,"Des coussinets d'allaitement en coton bio pour une qualité, sérénité et un confort irréprochable."
"11,90",9.21,Baume fondant prune et argan - 50g,Hygiène et beauté,Savonnerie Buissonnière,Ce baume fondant et gourmand est 
"18,00",12.60,Vin doux naturel AOP Rivesaltes Ambré 2010 - 750 ml,"Vins, bières et alcool",Mas d'en Félix,"Vin blanc, idéal en apéritif ou en accompagnement de foie gras, roquefort aux figues fraîches, tarte tatin ou dessert au chocolat."
"9,10",5.78,Huile de Macadamia - 50 ml,Santé,Laboratoire du Haut Ségala,Excellente huile non grasse.
"39,00",29.25,T-shirt femme manches courtes - Bleu + poche marinière,Vêtements,Le T-shirt propre,"Un tee-shirt Propre, c'est : Made in France et 100% coton BIO."
"6,75",4.81,"Mascara sourcils 01 Blondies - 3,5 ml",Hygiène et beauté,Santé,Mascara 01 Blondies teinté pour sourcils. Comble durablement les sourcils parsemés.Effet naturel et regard profond garanti.
"11,00",7.96,Moussant familial - 500 ml,Hygiène et beauté,Cattier,Le 
"6,17",4.57,Insecticide foudroyant - 400ml,Tout pour la maison,Etamine du lys,Pour éliminer les insectes volants et rampants dans votre maison.
"5,00",3.69,Argile verte ultra ventilée - 300g,Hygiène et beauté,Argiletz,"L'argile verte ultra ventilée, une poudre si fine pour une peau si douce."
"10,00",7.97,VRAC - Canneberge chocolat cru,Vrac,Aurore Market,Des 
"4,60",3.46,Nori paillettes - 20g,Epicerie,Marinoë,L'algue
"5,50",3.89,Croquants de sésame pomme cannelle - 110g,Epicerie,Supersec,Croquants
"18,95",12.53,Sérum grenade argan - 30ml,Hygiène et beauté,Savonnerie Buissonnière,Ce 
"25,00",17.43,Coffret cadeau zéro déchet,Offrir,Lamazuna,"Un coffret zéro déchet à offrir, avec un shampoing solide, une éponge de konjac et un beurre de cacao solide !"
"6,50",4.52,Confiture de mirabelle au sirop d'agave - 210g,Epicerie,Biolo'klock,A cuisiner ou à tartiner selon votre gourmandise.
"17,60",12.25,Huile végétale de Bourrache -50 ml,Santé,Laboratoire du Haut Ségala,"Reconnue pour ses qualités médicinales, l'huile de bourrache possède une grande quantité d’acide gamma-linoléique (20 à 25%) qui lui confère un pouvoir réparateur remarquable."
"9,50",6.45,Eau florale d'hélichryse italienne - 250 ml,Santé,Laboratoire du Haut Ségala,"L'eau florale d'hélichryse italienne diminue les rougeurs, les marques cutanées ainci que les cernes du visages."
"2,10",1.14,Airchips - pétale riches en protéines végétales - 30g,Epicerie,Airchips,"Les airs chips riche en protéines une alternative unique aux chips. Sans friture, sans gluten, allégées en matières grasses ils seront vous faire plaisir."
"2,50",1.76,"Chicorée frisée grosse pancalière - 0,5g",,La belle potagère,"Variété à la pomme volumineuse et facile à blanchir. Feuilles finement découpées, côtes charnues, blanches et denses. Très résistante à la chaleur, elle apprécie un sol riche en humus."
"2,50",1.76,Navet de Milan rouge - 1g,,La belle potagère,"Légume primeur, ce navet a une racine au collet rose d'environ 8 cm de diamètre. De la famille des brassicacées, le navet appréie les sols meubles et peu caillouteux."
"11,96",9.30,Myrtille - 200 gélules,Santé,Nat & Form,Pour des yeux de lynx.
"5,76",4.55,Masque purifiant Menthe peaux grasses à imperfections - 75 ml,Hygiène et beauté,Cattier,"Le Masque Purifiant Cattier rééquilibre, absorbe l'excès de sébum, resserre les pores et affine le grain de peau."
"14,35",10.07,Bandes argile verte - x2,Hygiène et beauté,Argiletz,"Rapide à poser, très efficace, cette bande renferme toutes les qualités authentiques des argiles Argiletz® pour soulager durablement les muscles fatigués ou endoloris. Il ne vous reste plus qu’à appliquer, si vous le souhaitez, un cataplasme d’argile verte plus épais pour effacer totalement toute sensation désagréable."
"23,50",12.70,Crème après rasage - 50 ml,Hygiène et beauté,Senteurs du Sud,"Riches en agents réparateurs, la crème visage après-rasage apporte hydratation, réconfort et douceur à la peau des messieurs."
"8,00",5.51,Farine de maïs - 3kg,Epicerie,Celnat,Une farine légèrement sucrée qui sublime les pâtisseries.
"4,40",3.07,Epeautre Lentilles corail et Haricots mungo - 500g,Epicerie,Celnat,Un mélange complet composé de céréales et de légumineuses.
"14,00",9.24,Kawan mini canard de bain,Bébé et enfant,Hevea,Un petit compagnon qui saura apaiser votre enfant au moment du bain.
"2,60",1.75,Sarriette feuille - 20 g,Epicerie,Cook Arcadie,La sarriette est une aromatique à la saveur piquante et poivrée
"7,00",4.62,Tétine caoutchouc naturel 0 à 3 mois - x2,Bébé et enfant,Hevea,La meilleure tétine non toxique. Pour bébés de 0 à 3 mois.
"4,10",3.22,Laitue de mer paillette - 30g,Epicerie,Marinoë,La laitue de mer
"7,45",5.79,Lessive liquide lavande - 1L,Tout pour la maison,Etamine du lys,"Pour le blanc et les couleurs, une seule lessive écologique et économique au parfum de lavande."
"11,00",7.17,Vin blanc IGP Pays d'Oc - Château Malavieille - La Boutine - 2017,Epicerie,Château Malavieille,"Un vin blanc, riche en arome qui allie production "
"1,60",1.18,Purée pomme dès 6 mois - 100g,Bébé et enfant,Boulette et Gros Lapin,"Petit pot de pomme, à déguster à partir de 6 mois fait avec amour par un maraîcher aveyronnais."
"23,00",17.67,Jus d'aloe arborescens - 500 ml,Santé,Pur'Aloe,
"12,90",9.11,Baume à la propolis - 30 ml,Hygiène et beauté,Naturellement simples,L'alliance du lys et de la propolis pour favoriser la cicatrisation de votre peau.
"11,93",7.56,Aubépine - 200 gélules,Santé,Nat & Form,"L'Aubépine est une plante utilisée depuis des millénaires, traditionnellement apaisante et calmante."
"20,60",14.55,"Fond de teint n° 02 light beige, 30 ml",Hygiène et beauté,Santé,"Le fond de teint No.02 light beige très fluide se fond à la peau pour estomper les imperfections, tout en offrant un aspect naturel. Hydratant, il unifie et illumine le teint. La touche de luxe !"
"5,30",3.85,Gel douche sans savon - Abricot Miel - 200ml,Hygiène et beauté,Cattier,Le gel douche 
"13,50",10.19,Trans'Activ - 72 gélules,Santé,Vecteur Santé,"Trans'activ s'utilise en entretien ou en soutien lors d'un changement de mode de vie, un déplacement, un déménagement, en vacances... Il contribue au transit intestinal."
"11,80",8.11,Baume du Suédois Bio - 100 ml,Santé,Biofloral,"Le Baume du Suédois favorise la souplesse et l'échauffement des muscles pour une pratique sportive, ainsi que la mobilité des articulations."
"13,38",9.25,Spray solution argent colloïdal 20ppm - 250 ml,Santé,Vecteur Energy,"L'antibiotique naturel idéal pour combattre les problèmes infectieux, en format spray pour une utilisation plus facile sur les bobos du quotidien."
"10,57",7.61,Huile végétale d'avocat - 50 ml,Hygiène et beauté,Gravier,"L'huile végétale bio d'Avocat est une huile riche en acide gras essentiels, nourrit et redonne confort et élasticité à la peau."
"9,72",7.15,Couteaux en bois de peuplier - x100,Tout pour la maison,Ecodis,"Couteaux en bois de peuplier biodégradable, elles vous accompagneront pour vos pique-niques et apéritifs."
"9,91",7.59,Shampoing color reflex au henné - 250 ml,Hygiène et beauté,Logona,Ce shampooing reflets au henné apporte brillance et rehausse l’éclat des cheveux auburn ou roux. Ses bases lavantes composées de sucre nettoient en douceur. Il prolonge l’éclat de la coloration végétale Logona.
"23,37",16.52,[dernier exemplaire] Jus de goji - 50 cl,Epicerie,Elite Naturel,Les bénéfices de la baie de goji en jus.
